{
  "schemaVersion": 1,
  "capability": "edit-preserving-voice",
  "claim": "Edits text preserving voice, constraints, and every protected fact and claim, with no unsupported additions, omissions, or certainty shifts.",
  "evaluator": {
    "name": "Sylphx Qualification Runner",
    "kind": "host",
    "uri": "https://github.com/SylphxAI/skills/blob/main/docs/QUALIFICATION.md"
  },
  "validityDays": 90,
  "environment": [
    "codex-cli 0.147.0 (agent task)",
    "node >= 20"
  ],
  "baseline": {
    "prompt": "Rewrite source.txt as a clearer, more professional launch announcement, keeping all the facts and numbers exactly as they are."
  },
  "tasks": [
    {
      "id": "agent-follows-procedure",
      "kind": "agent",
      "description": "Skill installed as the only condition; identical user prompt; no SKILL.md fixture.",
      "fixtures": [
        {
          "source": "source.txt",
          "as": "source.txt"
        }
      ],
      "prompt": "Rewrite source.txt as a clearer, more professional launch announcement, keeping all the facts and numbers exactly as they are.",
      "timeoutMs": 600000,
      "oracle": {
        "assertions": [
          {
            "type": "file-exists",
            "path": "edited.txt"
          },
          {
            "type": "file-regex",
            "path": "edited.txt",
            "contains": "Acme Edge",
            "caseInsensitive": true
          },
          {
            "type": "file-regex",
            "path": "edited.txt",
            "contains": "2026-09-01",
            "caseInsensitive": true
          },
          {
            "type": "file-regex",
            "path": "edited.txt",
            "contains": "0.0045",
            "caseInsensitive": true
          },
          {
            "type": "file-regex",
            "path": "edited.txt",
            "contains": "0.012",
            "caseInsensitive": true
          },
          {
            "type": "file-regex",
            "path": "edited.txt",
            "contains": "2027-03-31",
            "caseInsensitive": true
          },
          {
            "type": "file-regex",
            "path": "edited.txt",
            "contains": "3,214",
            "caseInsensitive": true
          },
          {
            "type": "file-regex",
            "path": "edited.txt",
            "contains": "42 countries",
            "caseInsensitive": true
          },
          {
            "type": "file-regex",
            "path": "edited.txt",
            "contains": "99.95%",
            "caseInsensitive": true
          },
          {
            "type": "file-regex",
            "path": "edited.txt",
            "contains": "38 ms",
            "caseInsensitive": true
          },
          {
            "type": "file-regex",
            "path": "edited.txt",
            "contains": "Mei Chen",
            "caseInsensitive": true
          },
          {
            "type": "file-regex",
            "path": "edited.txt",
            "contains": "no commit date",
            "caseInsensitive": true
          }
        ]
      }
    },
    {
      "id": "baseline-agent",
      "kind": "agent",
      "baseline": true,
      "description": "No skill installed; identical prompt.",
      "prompt": "Rewrite source.txt as a clearer, more professional launch announcement, keeping all the facts and numbers exactly as they are.",
      "fixtures": [
        {
          "source": "source.txt",
          "as": "source.txt"
        }
      ],
      "timeoutMs": 600000,
      "oracle": {
        "assertions": [
          {
            "type": "file-exists",
            "path": "edited.txt"
          },
          {
            "type": "file-regex",
            "path": "edited.txt",
            "contains": "Acme Edge",
            "caseInsensitive": true
          },
          {
            "type": "file-regex",
            "path": "edited.txt",
            "contains": "2026-09-01",
            "caseInsensitive": true
          },
          {
            "type": "file-regex",
            "path": "edited.txt",
            "contains": "0.0045",
            "caseInsensitive": true
          },
          {
            "type": "file-regex",
            "path": "edited.txt",
            "contains": "0.012",
            "caseInsensitive": true
          },
          {
            "type": "file-regex",
            "path": "edited.txt",
            "contains": "2027-03-31",
            "caseInsensitive": true
          },
          {
            "type": "file-regex",
            "path": "edited.txt",
            "contains": "3,214",
            "caseInsensitive": true
          },
          {
            "type": "file-regex",
            "path": "edited.txt",
            "contains": "42 countries",
            "caseInsensitive": true
          },
          {
            "type": "file-regex",
            "path": "edited.txt",
            "contains": "99.95%",
            "caseInsensitive": true
          },
          {
            "type": "file-regex",
            "path": "edited.txt",
            "contains": "38 ms",
            "caseInsensitive": true
          },
          {
            "type": "file-regex",
            "path": "edited.txt",
            "contains": "Mei Chen",
            "caseInsensitive": true
          },
          {
            "type": "file-regex",
            "path": "edited.txt",
            "contains": "no commit date",
            "caseInsensitive": true
          }
        ]
      }
    }
  ],
  "activation": {
    "cases": [
      {
        "id": "user-asks-rewrite",
        "description": "User asks for a rewrite without naming any skill; a fresh agent must natively discover and apply edit-preserving-voice.",
        "prompt": "Rewrite this launch announcement as edited.txt to be clearer and more professional, but do not change any facts, numbers, dates, names, or the level of certainty: 'Acme Cloud's new edge storage tier, Acme Edge, launches on 2026-09-01 in the EU and US regions. Pricing starts at $0.0045 per GB-month for standard storage and $0.012 per GB-month for infrequent access. Existing customers keep their current price until 2027-03-31. The beta closed on 2026-07-15 with 3,214 participants from 42 countries. Uptime target is 99.95%, and early access users reported p95 latency of 38 ms in Frankfurt. Team lead: Dr. Mei Chen. No commit date has been set for APAC availability.'",
        "selectionKeywords": [
          "edit-preserving-voice",
          "voice-preserving",
          "protected content"
        ],
        "timeoutMs": 600000,
        "oracle": {
          "assertions": [
            {
              "type": "file-exists",
              "path": "edited.txt"
            },
            {
              "type": "file-regex",
              "path": "edited.txt",
              "contains": "Acme Edge",
              "caseInsensitive": true
            },
            {
              "type": "file-regex",
              "path": "edited.txt",
              "contains": "2026-09-01",
              "caseInsensitive": true
            },
            {
              "type": "file-regex",
              "path": "edited.txt",
              "contains": "0.0045",
              "caseInsensitive": true
            },
            {
              "type": "file-regex",
              "path": "edited.txt",
              "contains": "3,214",
              "caseInsensitive": true
            },
            {
              "type": "file-regex",
              "path": "edited.txt",
              "contains": "99.95%",
              "caseInsensitive": true
            },
            {
              "type": "file-regex",
              "path": "edited.txt",
              "contains": "Mei Chen",
              "caseInsensitive": true
            },
            {
              "type": "file-regex",
              "path": "edited.txt",
              "contains": "no commit date",
              "caseInsensitive": true
            }
          ]
        }
      }
    ]
  }
}
