{
  "schemaVersion": 1,
  "capability": "model-security-threats",
  "claim": "Produces a Threat Model and Security Design Contract: protected assets, trust boundaries, evidence-ranked threats, controls traced to threats, and falsifiable verification.",
  "evaluator": {
    "name": "Sylphx Qualification Runner",
    "kind": "host",
    "uri": "https://github.com/SylphxAI/skills/blob/main/docs/QUALIFICATION.md"
  },
  "validityDays": 90,
  "environment": [
    "codex-cli 0.147.0 (agent task)",
    "node >= 20"
  ],
  "baseline": {
    "prompt": "Write threat-model.md for a public checkout flow (client browser, TLS edge, payment provider, internal ledger). List the main threats and what controls you would put in place."
  },
  "tasks": [
    {
      "id": "agent-follows-procedure",
      "kind": "agent",
      "description": "Fresh-context agent with the full procedure produces the Threat Model and Security Design Contract.",
      "fixtures": [
        {
          "source": "package:SKILL.md",
          "as": "SKILL.md"
        }
      ],
      "prompt": "Read ./SKILL.md completely, then write threat-model.md for a public checkout flow: client browser, TLS edge, payment provider, internal ledger, admin refund path. Follow the method: subject/version/environment/users/security objectives; protected assets and unacceptable outcomes; components, trust boundaries, entry points, admin and recovery paths; misuse and abuse cases ranked with evidence-bounded likelihood/impact/detectability; controls traced to threats with enforcement point, owner, failure mode and bypass assumptions; verification that could falsify each control; residual risk and decision authority.",
      "timeoutMs": 600000,
      "oracle": {
        "assertions": [
          {
            "type": "file-exists",
            "path": "threat-model.md"
          },
          {
            "type": "file-regex",
            "path": "threat-model.md",
            "contains": "trust boundary",
            "caseInsensitive": true
          },
          {
            "type": "file-regex",
            "path": "threat-model.md",
            "contains": "asset",
            "caseInsensitive": true
          },
          {
            "type": "file-regex",
            "path": "threat-model.md",
            "contains": "unacceptable outcome",
            "caseInsensitive": true
          },
          {
            "type": "file-regex",
            "path": "threat-model.md",
            "contains": "threat",
            "caseInsensitive": true
          },
          {
            "type": "file-regex",
            "path": "threat-model.md",
            "contains": "likelihood",
            "caseInsensitive": true
          },
          {
            "type": "file-regex",
            "path": "threat-model.md",
            "contains": "control",
            "caseInsensitive": true
          },
          {
            "type": "file-regex",
            "path": "threat-model.md",
            "contains": "falsif",
            "caseInsensitive": true
          },
          {
            "type": "file-regex",
            "path": "threat-model.md",
            "contains": "residual risk",
            "caseInsensitive": true
          }
        ]
      }
    },
    {
      "id": "baseline-agent",
      "kind": "agent",
      "baseline": true,
      "description": "Fresh-context baseline (no skill): same task, same Threat Model oracle.",
      "prompt": "Write threat-model.md for a public checkout flow (client browser, TLS edge, payment provider, internal ledger). List the main threats and what controls you would put in place.",
      "timeoutMs": 600000,
      "oracle": {
        "assertions": [
          {
            "type": "file-exists",
            "path": "threat-model.md"
          },
          {
            "type": "file-regex",
            "path": "threat-model.md",
            "contains": "trust boundary",
            "caseInsensitive": true
          },
          {
            "type": "file-regex",
            "path": "threat-model.md",
            "contains": "asset",
            "caseInsensitive": true
          },
          {
            "type": "file-regex",
            "path": "threat-model.md",
            "contains": "unacceptable outcome",
            "caseInsensitive": true
          },
          {
            "type": "file-regex",
            "path": "threat-model.md",
            "contains": "threat",
            "caseInsensitive": true
          },
          {
            "type": "file-regex",
            "path": "threat-model.md",
            "contains": "likelihood",
            "caseInsensitive": true
          },
          {
            "type": "file-regex",
            "path": "threat-model.md",
            "contains": "control",
            "caseInsensitive": true
          },
          {
            "type": "file-regex",
            "path": "threat-model.md",
            "contains": "falsif",
            "caseInsensitive": true
          },
          {
            "type": "file-regex",
            "path": "threat-model.md",
            "contains": "residual risk",
            "caseInsensitive": true
          }
        ]
      }
    }
  ],
  "activation": {
    "cases": [
      {
        "id": "user-asks-threat-model",
        "description": "User asks for a threat model without naming any skill; a fresh agent must natively discover and apply model-security-threats.",
        "prompt": "We are about to launch a public checkout flow (client browser, TLS edge, payment provider, internal ledger, admin refund path). Write threat-model.md covering the main threats, how serious they are, the controls we should put in place, and how we would verify the controls hold.",
        "selectionKeywords": [
          "model-security-threats",
          "Threat Model",
          "trust boundary",
          "residual risk"
        ],
        "timeoutMs": 600000,
        "oracle": {
          "assertions": [
            {
              "type": "file-exists",
              "path": "threat-model.md"
            },
            {
              "type": "file-regex",
              "path": "threat-model.md",
              "contains": "trust boundary",
              "caseInsensitive": true
            },
            {
              "type": "file-regex",
              "path": "threat-model.md",
              "contains": "threat",
              "caseInsensitive": true
            },
            {
              "type": "file-regex",
              "path": "threat-model.md",
              "contains": "likelihood",
              "caseInsensitive": true
            },
            {
              "type": "file-regex",
              "path": "threat-model.md",
              "contains": "control",
              "caseInsensitive": true
            },
            {
              "type": "file-regex",
              "path": "threat-model.md",
              "contains": "verification",
              "caseInsensitive": true
            }
          ]
        }
      }
    ]
  }
}
