{
  "schemaVersion": 1,
  "capability": "record-structured-deliberation",
  "claim": "Produces a Deliberation Record with question/owner/participants/protocol, linked proposal-objection-rebuttal positions, dissent, commitments and handoff.",
  "evaluator": {
    "name": "Sylphx Qualification Runner",
    "kind": "host",
    "uri": "https://github.com/SylphxAI/skills/blob/main/docs/QUALIFICATION.md"
  },
  "validityDays": 90,
  "environment": [
    "codex-cli 0.147.0 (agent task)",
    "node >= 20"
  ],
  "baseline": {
    "prompt": "Write deliberation.md recording a discussion about whether to adopt a new search engine for the product search. Include who decided, what was discussed, and what happens next."
  },
  "tasks": [
    {
      "id": "agent-follows-procedure",
      "kind": "agent",
      "description": "Skill installed as the only condition; identical user prompt; no SKILL.md fixture.",
      "prompt": "Write deliberation.md recording a discussion about whether to adopt a new search engine for the product search. Include who decided, what was discussed, and what happens next.",
      "timeoutMs": 600000,
      "oracle": {
        "assertions": [
          {
            "type": "file-exists",
            "path": "deliberation.md"
          },
          {
            "type": "file-regex",
            "path": "deliberation.md",
            "contains": "question",
            "caseInsensitive": true
          },
          {
            "type": "file-regex",
            "path": "deliberation.md",
            "contains": "owner",
            "caseInsensitive": true
          },
          {
            "type": "file-regex",
            "path": "deliberation.md",
            "contains": "participant",
            "caseInsensitive": true
          },
          {
            "type": "file-regex",
            "path": "deliberation.md",
            "contains": "protocol",
            "caseInsensitive": true
          },
          {
            "type": "file-regex",
            "path": "deliberation.md",
            "contains": "proposal",
            "caseInsensitive": true
          },
          {
            "type": "file-regex",
            "path": "deliberation.md",
            "contains": "objection",
            "caseInsensitive": true
          },
          {
            "type": "file-regex",
            "path": "deliberation.md",
            "contains": "rebuttal",
            "caseInsensitive": true
          },
          {
            "type": "file-regex",
            "path": "deliberation.md",
            "contains": "dissent",
            "caseInsensitive": true
          },
          {
            "type": "file-regex",
            "path": "deliberation.md",
            "contains": "handoff",
            "caseInsensitive": true
          }
        ]
      }
    },
    {
      "id": "baseline-agent",
      "kind": "agent",
      "baseline": true,
      "description": "No skill installed; identical prompt.",
      "prompt": "Write deliberation.md recording a discussion about whether to adopt a new search engine for the product search. Include who decided, what was discussed, and what happens next.",
      "timeoutMs": 600000,
      "oracle": {
        "assertions": [
          {
            "type": "file-exists",
            "path": "deliberation.md"
          },
          {
            "type": "file-regex",
            "path": "deliberation.md",
            "contains": "question",
            "caseInsensitive": true
          },
          {
            "type": "file-regex",
            "path": "deliberation.md",
            "contains": "owner",
            "caseInsensitive": true
          },
          {
            "type": "file-regex",
            "path": "deliberation.md",
            "contains": "participant",
            "caseInsensitive": true
          },
          {
            "type": "file-regex",
            "path": "deliberation.md",
            "contains": "protocol",
            "caseInsensitive": true
          },
          {
            "type": "file-regex",
            "path": "deliberation.md",
            "contains": "proposal",
            "caseInsensitive": true
          },
          {
            "type": "file-regex",
            "path": "deliberation.md",
            "contains": "objection",
            "caseInsensitive": true
          },
          {
            "type": "file-regex",
            "path": "deliberation.md",
            "contains": "rebuttal",
            "caseInsensitive": true
          },
          {
            "type": "file-regex",
            "path": "deliberation.md",
            "contains": "dissent",
            "caseInsensitive": true
          },
          {
            "type": "file-regex",
            "path": "deliberation.md",
            "contains": "handoff",
            "caseInsensitive": true
          }
        ]
      }
    }
  ]
}
